{
  "schema_version": "slot-alignment.calibration-batch-manifest.v6",
  "task_id": "<task-id>",
  "batch_id": "cv0001",
  "search_layer_id": "<layer-id>",
  "stage": "SCREEN",
  "cumulative_paid_entries": 100000,
  "metric_contract_sha256": "<sha256>",
  "sample_execution_plan_sha256": "<sha256>",
  "runtime_capability_matrix_sha256": "<sha256>",
  "status": "completed",
  "candidates": [
    {
      "candidate_id": "<candidate-id>",
      "parameter_record": {"path": "work/calibration/cv0001/candidates/<candidate-id>/parameter_record.json", "sha256": "<sha256>"},
      "measurements": {"path": "work/calibration/cv0001/candidates/<candidate-id>/measurements.json", "sha256": "<sha256>"},
      "alignment_result": {"path": "work/calibration/cv0001/candidates/<candidate-id>/alignment_result.json", "sha256": "<sha256>"},
      "rank": {"n_failures": 0, "alignment_failures": 0, "unknown_instances": 0, "maximum_deviation_ratio": 0.0, "deviation_ratio_sum": 0.0, "candidate_id": "<candidate-id>"},
      "status": "ranked"
    }
  ],
  "completed_at": "<ISO-8601>"
}
